{
  "$schema": "https://json-schema.org/draft/2020-12/schema",
  "type": "object",
  "properties": {
    "title": {
      "type": "string"
    },
    "date": {
      "type": "string"
    },
    "time": {
      "type": "string"
    },
    "location": {
      "type": "string"
    },
    "badge": {
      "type": "string"
    },
    "description": {
      "type": "string"
    },
    "ctaText": {
      "type": "string"
    },
    "ctaLink": {
      "type": "string"
    },
    "$schema": {
      "type": "string"
    }
  },
  "required": [
    "title",
    "date",
    "time",
    "location",
    "badge",
    "description",
    "ctaText",
    "ctaLink"
  ]
}