{
  "title": "Sosialisasi & Alur PPDB SMA Negeri 1 Klaten Tahun Ajaran 2026/2027",
  "date": "18 - 25 Mei 2026",
  "time": "08:00 - 15:00 WIB",
  "location": "Aula Graha Smansa & Layanan Konsultasi Online (SmansaBot)",
  "badge": "Agenda Resmi PPDB",
  "description": "Informasi resmi petunjuk teknis penerimaan peserta didik baru (PPDB) Jawa Tengah: verifikasi berkas, aktivasi akun, pemilihan jalur zonasi, afirmasi, prestasi, dan mutasi orang tua.",
  "ctaText": "Tanya SmansaBot seputar PPDB ↗",
  "ctaLink": "#chatbot"
}
